"","dwc","low_dwc","definition","plantr","speciesLink","gbif"
"124","highestBiostratigraphicZone","highestbiostratigraphiczone","The full name of the highest possible geological biostratigraphic zone of the stratigraphic horizon from which the cataloged item was collected.",NA,NA,NA
"125","lithostratigraphicTerms","lithostratigraphicterms","The combination of all litho-stratigraphic names for the rock from which the cataloged item was collected.",NA,NA,NA
"126","group","group","The full name of the lithostratigraphic group from which the cataloged item was collected.",NA,NA,NA
"127","formation","formation","The full name of the lithostratigraphic formation from which the cataloged item was collected.",NA,NA,NA
"128","member","member","The full name of the lithostratigraphic member from which the cataloged item was collected.",NA,NA,NA
"129","bed","bed","The full name of the lithostratigraphic bed from which the cataloged item was collected.",NA,NA,NA
"130","identificationID","identificationid","An identifier for the Identification (the body of information associated with the assignment of a scientific name). May be a global unique identifier or an identifier specific to the data set.",NA,NA,"identificationID"
"131","identificationQualifier","identificationqualifier","A brief phrase or a standard term (""cf."", ""aff."") to express the determiner's doubts about the Identification.",NA,NA,"identificationQualifier"
"132","typeStatus","typestatus","A list (concatenated and separated) of nomenclatural types (type status, typified scientific name, publication) applied to the subject.","typeStatus","typeStatus",NA
"133","identifiedBy","identifiedby","A list (concatenated and separated) of names of people, groups, or organizations who assigned the Taxon to the subject.","identifiedBy","identifiedBy","identifiedBy"
"134","dateIdentified","dateidentified","The date on which the subject was identified as representing the Taxon.","dateIdentified",NA,"dateIdentified"
"135","identificationReferences","identificationreferences","A list (concatenated and separated) of references (publication, global unique identifier, URI) used in the Identification.",NA,NA,NA
"136","identificationVerificationStatus","identificationverificationstatus","A categorical indicator of the extent to which the taxonomic identification has been verified to be correct.",NA,NA,NA
"137","identificationRemarks","identificationremarks","Comments or notes about the Identification.",NA,NA,"identificationRemarks"
"138","taxonID","taxonid","An identifier for the set of taxon information (data associated with the Taxon class). May be a global unique identifier or an identifier specific to the data set.",NA,NA,"taxonID"
"139","scientificNameID","scientificnameid","An identifier for the nomenclatural (not taxonomic) details of a scientific name.",NA,NA,NA
"140","acceptedNameUsageID","acceptednameusageid","An identifier for the name usage (documented meaning of the name according to a source) of the currently valid (zoological) or accepted (botanical) taxon.",NA,NA,NA
"141","parentNameUsageID","parentnameusageid","An identifier for the name usage (documented meaning of the name according to a source) of the direct, most proximate higher-rank parent taxon (in a classification) of the most specific element of the scientificName.",NA,NA,NA
"142","originalNameUsageID","originalnameusageid","An identifier for the name usage (documented meaning of the name according to a source) in which the terminal element of the scientificName was originally established under the rules of the associated nomenclaturalCode.",NA,NA,NA
"143","nameAccordingToID","nameaccordingtoid","An identifier for the source in which the specific taxon concept circumscription is defined or implied. See nameAccordingTo.",NA,NA,NA
"144","namePublishedInID","namepublishedinid","An identifier for the publication in which the scientificName was originally established under the rules of the associated nomenclaturalCode.",NA,NA,NA
"145","taxonConceptID","taxonconceptid","An identifier for the taxonomic concept to which the record refers - not for the nomenclatural details of a taxon.",NA,NA,NA
"146","scientificName","scientificname","The full scientific name, with authorship and date information if known. When forming part of an Identification, this should be the name in lowest level taxonomic rank that can be determined. This term should not contain identification qualifications, which should instead be supplied in the IdentificationQualifier term.","scientificName","scientificName","scientificName"
"147","acceptedNameUsage","acceptednameusage","The full name, with authorship and date information if known, of the currently valid (zoological) or accepted (botanical) taxon.",NA,NA,"acceptedNameUsage"
"148","parentNameUsage","parentnameusage","The full name, with authorship and date information if known, of the direct, most proximate higher-rank parent taxon (in a classification) of the most specific element of the scientificName.",NA,NA,"parentNameUsage"
"149","originalNameUsage","originalnameusage","The taxon name, with authorship and date information if known, as it originally appeared when first established under the rules of the associated nomenclaturalCode. The basionym (botany) or basonym (bacteriology) of the scientificName or the senior/earlier homonym for replaced names.",NA,NA,NA
"150","nameAccordingTo","nameaccordingto","The reference to the source in which the specific taxon concept circumscription is defined or implied - traditionally signified by the Latin ""sensu"" or ""sec."" (from secundum, meaning ""according to""). For taxa that result from identifications, a reference to the keys, monographs, experts and other sources should be given.",NA,NA,"nameAccordingTo"
"151","namePublishedIn","namepublishedin","A reference for the publication in which the scientificName was originally established under the rules of the associated nomenclaturalCode.",NA,NA,"namePublishedIn"
"152","namePublishedInYear","namepublishedinyear","The four-digit year in which the scientificName was published.",NA,NA,"namePublishedInYear"
"153","higherClassification","higherclassification","A list (concatenated and separated) of taxa names terminating at the rank immediately superior to the taxon referenced in the taxon record.",NA,NA,"higherClassification"
"154","kingdom","kingdom","The full scientific name of the kingdom in which the taxon is classified.",NA,"kingdom","kingdom"
"155","phylum","phylum","The full scientific name of the phylum or division in which the taxon is classified.",NA,"phylum","phylum"
"156","class","class","The full scientific name of the class in which the taxon is classified.",NA,"class","class"
"157","order","order","The full scientific name of the order in which the taxon is classified.",NA,"order","order"
"158","family","family","The full scientific name of the family in which the taxon is classified.",NA,"family","family"
"159","genus","genus","The full scientific name of the genus in which the taxon is classified.",NA,"genus","genus"
"160","subgenus","subgenus","The full scientific name of the subgenus in which the taxon is classified. Values should include the genus to avoid homonym confusion.",NA,NA,NA
"161","specificEpithet","specificepithet","The name of the first or species epithet of the scientificName.",NA,"specificEpithet","specificEpithet"
"162","infraspecificEpithet","infraspecificepithet","The name of the lowest or terminal infraspecific epithet of the scientificName, excluding any rank designation.",NA,"infraspecificEpithet","infraspecificEpithet"
"163","taxonRank","taxonrank","The taxonomic rank of the most specific name in the scientificName.",NA,NA,"taxonRank"
"164","verbatimTaxonRank","verbatimtaxonrank","The taxonomic rank of the most specific name in the scientificName as it appears in the original record.",NA,NA,"verbatimTaxonRank"
"165","scientificNameAuthorship","scientificnameauthorship","The authorship information for the scientificName formatted according to the conventions of the applicable nomenclaturalCode.","scientificNameAuthorship","scientificNameAuthorship",NA
"166","vernacularName","vernacularname","A common or vernacular name.",NA,NA,"vernacularName"
"167","nomenclaturalCode","nomenclaturalcode","The nomenclatural code (or codes in the case of an ambiregnal name) under which the scientificName is constructed.",NA,NA,"nomenclaturalCode"
"168","taxonomicStatus","taxonomicstatus","The status of the use of the scientificName as a label for a taxon. Requires taxonomic opinion to define the scope of a taxon. Rules of priority then are used to define the taxonomic status of the nomenclature contained in that scope, combined with the experts opinion. It must be linked to a specific taxonomic reference that defines the concept.",NA,NA,"taxonomicStatus"
"169","nomenclaturalStatus","nomenclaturalstatus","The status related to the original publication of the name and its conformance to the relevant rules of nomenclature. It is based essentially on an algorithm according to the business rules of the code. It requires no taxonomic opinion.",NA,NA,"nomenclaturalStatus"
"170","taxonRemarks","taxonremarks","Comments or notes about the taxon or name.",NA,NA,NA
"171","measurementID","measurementid","An identifier for the MeasurementOrFact (information pertaining to measurements, facts, characteristics, or assertions). May be a global unique identifier or an identifier specific to the data set.",NA,NA,NA
"172","measurementType","measurementtype","The nature of the measurement, fact, characteristic, or assertion.",NA,NA,NA
"173","measurementValue","measurementvalue","The value of the measurement, fact, characteristic, or assertion.",NA,NA,NA
"174","measurementAccuracy","measurementaccuracy","The description of the potential error associated with the measurementValue.",NA,NA,NA
"175","measurementUnit","measurementunit","The units associated with the measurementValue.",NA,NA,NA
"176","measurementDeterminedBy","measurementdeterminedby","A list (concatenated and separated) of names of people, groups, or organizations who determined the value of the MeasurementOrFact.",NA,NA,NA
"177","measurementDeterminedDate","measurementdetermineddate","The date on which the MeasurementOrFact was made.",NA,NA,NA
"178","measurementMethod","measurementmethod","A description of or reference to (publication, URI) the method or protocol used to determine the measurement, fact, characteristic, or assertion.",NA,NA,NA
"179","measurementRemarks","measurementremarks","Comments or notes accompanying the MeasurementOrFact.",NA,NA,NA
"180","resourceRelationshipID","resourcerelationshipid","An identifier for an instance of relationship between one resource (the subject) and another (relatedResource, the object).",NA,NA,NA
"181","resourceID","resourceid","An identifier for the resource that is the subject of the relationship.",NA,NA,NA
"182","relatedResourceID","relatedresourceid","An identifier for a related resource (the object, rather than the subject of the relationship).",NA,NA,NA
"183","relationshipOfResource","relationshipofresource","The relationship of the resource identified by relatedResourceID to the subject (optionally identified by the resourceID).",NA,NA,NA
"184","relationshipAccordingTo","relationshipaccordingto","The source (person, organization, publication, reference) establishing the relationship between the two resources.",NA,NA,NA
"185","relationshipEstablishedDate","relationshipestablisheddate","The date-time on which the relationship between the two resources was established.",NA,NA,NA
"186","relationshipRemarks","relationshipremarks","Comments or notes about the relationship between the two resources.",NA,NA,NA
"187","UseWithIRI","usewithiri","The category of terms that are recommended to have an IRI as a value.",NA,NA,NA
"188","inDescribedPlace","indescribedplace","Use to link a dcterms:Location instance subject to the lowest level standardized hierarchically-described resource.",NA,NA,NA
"189","identifiedBy","identifiedby","A person, group, or organization who assigned the Taxon to the subject.","identifiedBy","identifiedBy","identifiedBy"
"190","recordedBy","recordedby","A person, group, or organization responsible for recording the original Occurrence.","recordedBy","recordedBy","recordedBy"
"191","toTaxon","totaxon","Use to link a dwc:Identification instance subject to a taxonomic entity such as a taxon, taxon concept, or taxon name use.",NA,NA,NA
"192","inCollection","incollection","Use to link any subject resource that is part of a collection to the collection containing the resource.",NA,NA,NA
"193","georeferencedBy","georeferencedby","A person, group, or organization who determined the georeference (spatial representation) for the Location.",NA,NA,"georeferencedBy"
"194","behavior","behavior","A description of the behavior shown by the subject at the time the Occurrence was recorded.",NA,NA,NA
"195","earliestGeochronologicalEra","earliestgeochronologicalera","Use to link a dwc:GeologicalContext instance to chronostratigraphic time periods at the lowest possible level in a standardized hierarchy.   Use this property to point to the earliest possible geological time period from which the cataloged item was collected.",NA,NA,NA
"196","fromLithostratigraphicUnit","fromlithostratigraphicunit","Use to link a dwc:GeologicalContext instance to an IRI-identified lithostratigraphic unit at the lowest possible level in a hierarchy.",NA,NA,NA
"197","georeferenceSources","georeferencesources","A map, gazetteer, or other resource used to georeference the Location.",NA,NA,"georeferenceSources"
"198","identificationQualifier","identificationqualifier","A controlled value to express the determiner's doubts about the Identification.",NA,NA,"identificationQualifier"
"199","inDataset","indataset","Use to link a subject dataset record to the dataset which contains it.",NA,NA,NA
"200","latestGeochronologicalEra","latestgeochronologicalera","Use to link a dwc:GeologicalContext instance to chronostratigraphic time periods at the lowest possible level in a standardized hierarchy.   Use this property to point to the latest possible geological time period from which the cataloged item was collected.",NA,NA,NA
"201","measurementDeterminedBy","measurementdeterminedby","A person, group, or organization who determined the value of the MeasurementOrFact.",NA,NA,NA
"202","measurementMethod","measurementmethod","The method or protocol used to determine the measurement, fact, characteristic, or assertion.",NA,NA,NA
"203","preparations","preparations","A preparation or preservation method for a specimen.",NA,NA,"preparations"
"204","samplingProtocol","samplingprotocol","The method or protocol used during an Event.",NA,NA,"samplingProtocol"
"205","typeStatus","typestatus","A nomenclatural type (type status, typified scientific name, publication) applied to the subject.","typeStatus","typeStatus",NA
"206","Accepted Name Usage","accepted name usage","The full name, with authorship and date information if known, of the currently valid (zoological) or accepted (botanical) taxon.",NA,NA,NA
"207","Accepted Name Usage ID","accepted name usage id","An identifier for the name usage (documented meaning of the name according to a source) of the currently valid (zoological) or accepted (botanical) taxon.",NA,NA,NA
"208","Associated Media","associated media","A list (concatenated and separated) of identifiers (publication, global unique identifier, URI) of media associated with the Occurrence.",NA,NA,NA
"209","Associated Occurrences","associated occurrences","A list (concatenated and separated) of identifiers of other Occurrence records and their associations to this Occurrence.",NA,NA,NA
"210","Associated Organisms","associated organisms","A list (concatenated and separated) of identifiers of other Organisms and their associations to this Organism.",NA,NA,NA
"211","Associated References","associated references","A list (concatenated and separated) of identifiers (publication, bibliographic reference, global unique identifier, URI) of literature associated with the Occurrence.",NA,NA,NA
"212","Associated Sequences","associated sequences","A list (concatenated and separated) of identifiers (publication, global unique identifier, URI) of genetic sequence information associated with the Occurrence.",NA,NA,NA
"213","Associated Taxa","associated taxa","A list (concatenated and separated) of identifiers or names of taxa and their associations with the Occurrence.",NA,NA,NA
"214","Basis of Record","basis of record","The specific nature of the data record - a subtype of the dcterms:type. Recommended best practice is to use a controlled vocabulary such as the Darwin Core Type Vocabulary (http://rs.tdwg.org/dwc/terms/type-vocabulary/index.htm).",NA,NA,NA
"215","Basis of Record","basis of record","The specific nature of the data record - a subtype of the dcterms:type. Recommended best practice is to use a controlled vocabulary.",NA,NA,NA
"216","Basis of Record","basis of record","The specific nature of the data record. Recommended best practice is to use a controlled vocabulary such as the Darwin Core Type Vocabulary (http://rs.tdwg.org/dwc/terms/type-vocabulary/index.htm).",NA,NA,NA
"217","Basis of Record","basis of record","The specific nature of the data record.",NA,NA,NA
"218","Bed","bed","The full name of the lithostratigraphic bed from which the cataloged item was collected.",NA,NA,NA
"219","Behavior","behavior","A description of the behavior shown by the subject at the time the Occurrence was recorded. Recommended best practice is to use a controlled vocabulary.",NA,NA,NA
"220","Catalog Number","catalog number","An identifier (preferably unique) for the record within the data set or collection.",NA,NA,NA
"221","Class","class","The name of the class in which the scientificName is classified.",NA,"class","class"
"222","Class","class","The full scientific name of the class in which the taxon is classified.",NA,"class","class"
"223","Collection Code","collection code","The name (or acronym) identifying the collection or data set from which the record was derived.",NA,NA,NA
"224","Collection Code","collection code","The name, acronym, coden, or initialism identifying the collection or data set from which the record was derived.",NA,NA,NA
"225","Collection ID","collection id","An identifier for the collection or dataset from which the record was derived. For physical specimens, the recommended best practice is to use the identifier in a collections registry such as the Biodiversity Collections Index (http://www.biodiversitycollectionsindex.org/).",NA,NA,NA
"226","Collection ID","collection id","An identifier for the collection or dataset from which the record was derived.",NA,NA,NA
"227","Continent","continent","The name of the continent in which the Location occurs. Recommended best practice is to use a controlled vocabulary such as the Getty Thesaurus of Geographic Names.",NA,NA,"continent"
"228","Coordinate Precision","coordinate precision","A decimal representation of the precision of the coordinates given in the decimalLatitude and decimalLongitude.",NA,NA,NA
"229","Coordinate Uncertainty In Meters","coordinate uncertainty in meters","The horizontal distance (in meters) from the given decimalLatitude and decimalLongitude describing the smallest circle containing the whole of the Location. Leave the value empty if the uncertainty is unknown, cannot be estimated, or is not applicable (because there are no coordinates). Zero is not a valid value for this term.",NA,NA,NA
"230","Country","country","The name of the country or major administrative unit in which the Location occurs. Recommended best practice is to use a controlled vocabulary such as the Getty Thesaurus of Geographic Names.","country","country","country"
"231","Country Code","country code","The standard code for the country in which the Location occurs. Recommended best practice is to use ISO 3166-1-alpha-2 country codes.",NA,NA,NA
"232","County","county","The full, unabbreviated name of the next smaller administrative region than stateProvince (county, shire, department, etc.) in which the Location occurs.","county","county","county"
"233","Data Generalizations","data generalizations","Actions taken to make the shared data less specific or complete than in its original form. Suggests that alternative data of higher quality may be available on request.",NA,NA,NA
"234","Dataset ID","dataset id","An identifier for the data set. May be a global unique identifier or an identifier specific to a collection or institution.",NA,NA,NA
"235","Dataset ID","dataset id","An identifier for the set of data. May be a global unique identifier or an identifier specific to a collection or institution.",NA,NA,NA
"236","Dataset Name","dataset name","The name identifying the data set from which the record was derived.",NA,NA,NA
"237","Date Identified","date identified","The date on which the subject was identified as representing the taxon given in the scientificName. Recommended best practice is to use an encoding scheme, such as ISO 8601:2004(E).",NA,NA,NA
"238","Date Identified","date identified","The date on which the subject was identified as representing the Taxon. Recommended best practice is to use an encoding scheme, such as ISO 8601:2004(E).",NA,NA,NA
"239","Day","day","The integer day of the month on which the Event occurred.",NA,"day","day"
"240","Decimal Latitude","decimal latitude","The geographic latitude (in decimal degrees, using the spatial reference system given in geodeticDatum) of the geographic center of a Location. Positive values are north of the Equator, negative values are south of it. Legal values lie between -90 and 90, inclusive.",NA,NA,NA
"241","Decimal Longitude","decimal longitude","The geographic longitude (in decimal degrees, using the spatial reference system given in geodeticDatum) of the geographic center of a Location. Positive values are east of the Greenwich Meridian, negative values are west of it. Legal values lie between -180 and 180, inclusive.",NA,NA,NA
"242","Disposition","disposition","The current state of a specimen with respect to the collection identified in collectionCode or collectionID. Recommended best practice is to use a controlled vocabulary.",NA,NA,"disposition"
"243","Dynamic Properties","dynamic properties","A list (concatenated and separated) of additional measurements, facts, characteristics, or assertions about the record. Meant to provide a mechanism for structured content such as key-value pairs.",NA,NA,NA
"244","Dynamic Properties","dynamic properties","A list of additional measurements, facts, characteristics, or assertions about the record. Meant to provide a mechanism for structured content.",NA,NA,NA
"245","Earliest Age Or Lowest Stage","earliest age or lowest stage","The full name of the earliest possible geochronologic age or lowest chronostratigraphic stage attributable to the stratigraphic horizon from which the cataloged item was collected.",NA,NA,NA
"246","Earliest Eon Or Lowest Eonothem","earliest eon or lowest eonothem","The full name of the earliest possible geochronologic eon or lowest chrono-stratigraphic eonothem or the informal name (""Precambrian"") attributable to the stratigraphic horizon from which the cataloged item was collected.",NA,NA,NA
"247","Earliest Epoch Or Lowest Series","earliest epoch or lowest series","The full name of the earliest possible geochronologic epoch or lowest chronostratigraphic series attributable to the stratigraphic horizon from which the cataloged item was collected.",NA,NA,NA
"248","Earliest Era Or Lowest Erathem","earliest era or lowest erathem","The full name of the earliest possible geochronologic era or lowest chronostratigraphic erathem attributable to the stratigraphic horizon from which the cataloged item was collected.",NA,NA,NA
"249","Earliest Period Or Lowest System","earliest period or lowest system","The full name of the earliest possible geochronologic period or lowest chronostratigraphic system attributable to the stratigraphic horizon from which the cataloged item was collected.",NA,NA,NA
"250","End Day Of Year","end day of year","The latest ordinal day of the year on which the Event occurred (1 for January 1, 365 for December 31, except in a leap year, in which case it is 366).",NA,NA,NA
"251","Establishment Means","establishment means","The process by which the biological individual(s) represented in the Occurrence became established at the location. Recommended best practice is to use a controlled vocabulary.",NA,NA,NA
"252","Event Date","event date","The date-time or interval during which an Event occurred. For occurrences, this is the date-time when the event was recorded. Not suitable for a time in a geological context. Recommended best practice is to use an encoding scheme, such as ISO 8601:2004(E).",NA,NA,NA
"253","Event ID","event id","An identifier for the set of information associated with an Event (something that occurs at a place and time). May be a global unique identifier or an identifier specific to the data set.",NA,NA,NA
"254","Event Remarks","event remarks","Comments or notes about the Event.",NA,NA,NA
"255","Event Time","event time","The time or interval during which an Event occurred. Recommended best practice is to use an encoding scheme, such as ISO 8601:2004(E).",NA,NA,NA
"256","Family","family","The name of the family in which the scientificName is classified.",NA,"family","family"
"257","Family","family","The full scientific name of the family in which the taxon is classified.",NA,"family","family"
"258","Field Notes","field notes","One of a) an indicator of the existence of, b) a reference to (publication, URI), or c) the text of notes taken in the field about the Event.",NA,NA,NA
