"","dwc","low_dwc","definition","plantr","speciesLink","gbif"
"259","Field Number","field number","An identifier given to the event in the field. Often serves as a link between field notes and the Event.",NA,NA,NA
"260","Footprint Spatial Fit","footprint spatial fit","The ratio of the area of the footprint (footprintWKT) to the area of the true (original, or most specific) spatial representation of the Location. Legal values are 0, greater than or equal to 1, or undefined. A value of 1 is an exact match or 100% overlap. A value of 0 should be used if the given footprint does not completely contain the original representation. The footprintSpatialFit is undefined (and should be left blank) if the original representation is a point and the given georeference is not that same point. If both the original and the given georeference are the same point, the footprintSpatialFit is 1.",NA,NA,NA
"261","Footprint SRS","footprint srs","A Well-Known Text (WKT) representation of the Spatial Reference System (SRS) for the footprintWKT of the Location. Do not use this term to describe the SRS of the decimalLatitude and decimalLongitude, even if it is the same as for the footprintWKT - use the geodeticDatum instead.",NA,NA,NA
"262","Footprint WKT","footprint wkt","A Well-Known Text (WKT) representation of the shape (footprint, geometry) that defines the Location. A Location may have both a point-radius representation (see decimalLatitude) and a footprint representation, and they may differ from each other.",NA,NA,NA
"263","Formation","formation","The full name of the lithostratigraphic formation from which the cataloged item was collected.",NA,NA,NA
"264","Genus","genus","The name of the genus in which the scientificName is classified.",NA,"genus","genus"
"265","Genus","genus","The full scientific name of the genus in which the taxon is classified.",NA,"genus","genus"
"266","Geodetic Datum","geodetic datum","The ellipsoid, geodetic datum, or spatial reference system (SRS) upon which the geographic coordinates given in decimalLatitude and decimalLongitude as based. Recommended best practice is use the EPSG code as a controlled vocabulary to provide an SRS, if known. Otherwise use a controlled vocabulary for the name or code of the geodetic datum, if known. Otherwise use a controlled vocabulary for the name or code of the ellipsoid, if known. If none of these is known, use the value ""unknown"".",NA,NA,NA
"267","Geological Context ID","geological context id","An identifier for the set of information associated with a GeologicalContext (the location within a geological context, such as stratigraphy). May be a global unique identifier or an identifier specific to the data set.",NA,NA,NA
"268","Georeferenced By","georeferenced by","A list (concatenated and separated) of names of people, groups, or organizations who determined the georeference (spatial representation) for the Location.",NA,NA,NA
"269","Georeferenced Date","georeferenced date","The date on which the Location was georeferenced. Recommended best practice is to use an encoding scheme, such as ISO 8601:2004(E).",NA,NA,NA
"270","Georeference Protocol","georeference protocol","A description or reference to the methods used to determine the spatial footprint, coordinates, and uncertainties.",NA,NA,NA
"271","Georeference Remarks","georeference remarks","Notes or comments about the spatial description determination, explaining assumptions made in addition or opposition to the those formalized in the method referred to in georeferenceProtocol.",NA,NA,NA
"272","Georeference Sources","georeference sources","A list (concatenated and separated) of maps, gazetteers, or other resources used to georeference the Location, described specifically enough to allow anyone in the future to use the same resources.",NA,NA,NA
"273","Georeference Verification Status","georeference verification status","A categorical description of the extent to which the georeference has been verified to represent the best possible spatial description. Recommended best practice is to use a controlled vocabulary.",NA,NA,NA
"274","Group","group","The full name of the lithostratigraphic group from which the cataloged item was collected.",NA,NA,NA
"275","Habitat","habitat","A category or description of the habitat in which the Event occurred.",NA,NA,"habitat"
"276","Higher Classification","higher classification","A list (concatenated and separated) of taxa names terminating at the rank immediately superior to the taxon referenced in the taxon record. Recommended best practice is to order the list starting with the highest rank and separating the names for each rank with a semi-colon ("";"").",NA,NA,NA
"277","Higher Classification","higher classification","A list (concatenated and separated) of taxa names terminating at the rank immediately superior to the taxon referenced in the taxon record.",NA,NA,NA
"278","Higher Geography","higher geography","A list (concatenated and separated) of geographic names less specific than the information captured in the locality term.",NA,NA,NA
"279","Higher Geography ID","higher geography id","An identifier for the geographic region within which the Location occurred. Recommended best practice is to use an persistent identifier from a controlled vocabulary such as the Getty Thesaurus of Geographic Names.",NA,NA,NA
"280","Highest Biostratigraphic Zone","highest biostratigraphic zone","The full name of the highest possible geological biostratigraphic zone of the stratigraphic horizon from which the cataloged item was collected.",NA,NA,NA
"281","Identification ID","identification id","An identifier for the Identification (the body of information associated with the assignment of a scientific name). May be a global unique identifier or an identifier specific to the data set.",NA,NA,NA
"282","Identification Qualifier","identification qualifier","A brief phrase or a standard term (""cf."", ""aff."") to express the determiner's doubts about the Identification.",NA,NA,NA
"283","Identification References","identification references","A list (concatenated and separated) of references (publication, global unique identifier, URI) used in the Identification.",NA,NA,NA
"284","Identification Remarks","identification remarks","Comments or notes about the Identification.",NA,NA,NA
"285","Identification Verification Status","identification verification status","A categorical indicator of the extent to which the taxonomic identification has been verified to be correct. Recommended best practice is to use a controlled vocabulary such as that used in HISPID/ABCD.",NA,NA,NA
"286","Identified By","identified by","A list (concatenated and separated) of names of people, groups, or organizations who assigned the scientificName.",NA,NA,NA
"287","Identified By","identified by","A list (concatenated and separated) of names of people, groups, or organizations who assigned the Taxon to the subject.",NA,NA,NA
"288","Individual Count","individual count","The number of individuals represented present at the time of the Occurrence.",NA,NA,NA
"289","Information Withheld","information withheld","Additional information that exists, but that has not been shared in the given record.",NA,NA,NA
"290","Infraspecific Epithet","infraspecific epithet","The name of the second or subspecies epithet of the scientificName.",NA,NA,NA
"291","Infraspecific Epithet","infraspecific epithet","The name of the lowest or terminal infraspecific epithet of the scientificName, excluding any rank designation.",NA,NA,NA
"292","Institution Code","institution code","The name (or acronym) in use by the institution having custody of the object(s) or information referred to in the record.",NA,NA,NA
"293","Institution ID","institution id","An identifier for the institution having custody of the object(s) or information referred to in the record.",NA,NA,NA
"294","Island","island","The name of the island on or near which the Location occurs. Recommended best practice is to use a controlled vocabulary such as the Getty Thesaurus of Geographic Names.",NA,NA,"island"
"295","Island Group","island group","The name of the island group in which the Location occurs. Recommended best practice is to use a controlled vocabulary such as the Getty Thesaurus of Geographic Names.",NA,NA,NA
"296","Kingdom","kingdom","The name of the kingdom in which the scientificName is classified.",NA,"kingdom","kingdom"
"297","Kingdom","kingdom","The full scientific name of the kingdom in which the taxon is classified.",NA,"kingdom","kingdom"
"298","Latest AgeOr Highest Stage","latest ageor highest stage","The full name of the latest possible geochronologic age or highest chronostratigraphic stage attributable to the stratigraphic horizon from which the cataloged item was collected.",NA,NA,NA
"299","Latest Eon Or Highest Eonothem","latest eon or highest eonothem","The full name of the latest possible geochronologic eon or highest chrono-stratigraphic eonothem or the informal name (""Precambrian"") attributable to the stratigraphic horizon from which the cataloged item was collected.",NA,NA,NA
"300","Latest Epoch Or Highest Series","latest epoch or highest series","The full name of the latest possible geochronologic epoch or highest chronostratigraphic series attributable to the stratigraphic horizon from which the cataloged item was collected.",NA,NA,NA
"301","Latest Era Or Highest Erathem","latest era or highest erathem","The full name of the latest possible geochronologic era or highest chronostratigraphic erathem attributable to the stratigraphic horizon from which the cataloged item was collected.",NA,NA,NA
"302","Latest Period Or Highest System","latest period or highest system","The full name of the latest possible geochronologic period or highest chronostratigraphic system attributable to the stratigraphic horizon from which the cataloged item was collected.",NA,NA,NA
"303","Life Stage","life stage","The age class or life stage of the biological individual(s) at the time the Occurrence was recorded. Recommended best practice is to use a controlled vocabulary.",NA,NA,NA
"304","Lithostratigraphic Terms","lithostratigraphic terms","The combination of all litho-stratigraphic names for the rock from which the cataloged item was collected.",NA,NA,NA
"305","Locality","locality","The specific description of the place. Less specific geographic information can be provided in other geographic terms (higherGeography, continent, country, stateProvince, county, municipality, waterBody, island, islandGroup). This term may contain information modified from the original to correct perceived errors or standardize the description.",NA,"locality","locality"
"306","Location According To","location according to","Information about the source of this Location information. Could be a publication (gazetteer), institution, or team of individuals.",NA,NA,NA
"307","Location ID","location id","An identifier for the set of location information (data associated with dcterms:Location). May be a global unique identifier or an identifier specific to the data set.",NA,NA,NA
"308","Location Remarks","location remarks","Comments or notes about the Location.",NA,NA,NA
"309","Lowest Biostratigraphic Zone","lowest biostratigraphic zone","The full name of the lowest possible geological biostratigraphic zone of the stratigraphic horizon from which the cataloged item was collected.",NA,NA,NA
"310","Material Sample ID","material sample id","An identifier for the MaterialSample (as opposed to a particular digital record of the material sample). In the absence of a persistent global unique identifier, construct one from a combination of identifiers in the record that will most closely make the materialSampleID globally unique.",NA,NA,NA
"311","Maximum Depth In Meters","maximum depth in meters","The greater depth of a range of depth below the local surface, in meters.",NA,NA,NA
"312","Maximum Distance Above Surface In Meters","maximum distance above surface in meters","The greater distance in a range of distance from a reference surface in the vertical direction, in meters. Use positive values for locations above the surface, negative values for locations below. If depth measures are given, the reference surface is the location given by the depth, otherwise the reference surface is the location given by the elevation.",NA,NA,NA
"313","Maximum Elevation In Meters","maximum elevation in meters","The upper limit of the range of elevation (altitude, usually above sea level), in meters.",NA,NA,NA
"314","Measurement Accuracy","measurement accuracy","The description of the potential error associated with the measurementValue.",NA,NA,NA
"315","Measurement Determined By","measurement determined by","A list (concatenated and separated) of names of people, groups, or organizations who determined the value of the MeasurementOrFact.",NA,NA,NA
"316","Measurement Determined Date","measurement determined date","The date on which the MeasurementOrFact was made. Recommended best practice is to use an encoding scheme, such as ISO 8601:2004(E).",NA,NA,NA
"317","Measurement ID","measurement id","An identifier for the MeasurementOrFact (information pertaining to measurements, facts, characteristics, or assertions). May be a global unique identifier or an identifier specific to the data set.",NA,NA,NA
"318","Measurement Method","measurement method","A description of or reference to (publication, URI) the method or protocol used to determine the measurement, fact, characteristic, or assertion.",NA,NA,NA
"319","Measurement Remarks","measurement remarks","Comments or notes accompanying the MeasurementOrFact.",NA,NA,NA
"320","Measurement Type","measurement type","The nature of the measurement, fact, characteristic, or assertion. Recommended best practice is to use a controlled vocabulary.",NA,NA,NA
"321","Measurement Unit","measurement unit","The units associated with the measurementValue. Recommended best practice is to use the International System of Units (SI).",NA,NA,NA
"322","Measurement Value","measurement value","The value of the measurement, fact, characteristic, or assertion.",NA,NA,NA
"323","Member","member","The full name of the lithostratigraphic member from which the cataloged item was collected.",NA,NA,NA
"324","Minimum Depth In Meters","minimum depth in meters","The lesser depth of a range of depth below the local surface, in meters.",NA,NA,NA
"325","Minimum Distance Above Surface In Meters","minimum distance above surface in meters","The lesser distance in a range of distance from a reference surface in the vertical direction, in meters. Use positive values for locations above the surface, negative values for locations below. If depth measures are given, the reference surface is the location given by the depth, otherwise the reference surface is the location given by the elevation.",NA,NA,NA
"326","Minimum Elevation In Meters","minimum elevation in meters","The lower limit of the range of elevation (altitude, usually above sea level), in meters.",NA,NA,NA
"327","Month","month","The ordinal month in which the Event occurred.",NA,"month","month"
"328","Municipality","municipality","The full, unabbreviated name of the next smaller administrative region than county (city, municipality, etc.) in which the Location occurs. Do not use this term for a nearby named place that does not contain the actual location.","municipality",NA,"municipality"
"329","Name According To","name according to","The reference to the source in which the specific taxon concept circumscription is defined or implied - traditionally signified by the Latin ""sensu"" or ""sec."" (from secundum, meaning ""according to""). For taxa that result from identifications, a reference to the keys, monographs, experts and other sources should be given.",NA,NA,NA
"330","Name According To ID","name according to id","An identifier for the source in which the specific taxon concept circumscription is defined or implied. See nameAccordingTo.",NA,NA,NA
"331","Name Published In","name published in","A full reference to the original publication of the scientificName.",NA,NA,NA
"332","Name Published In","name published in","A reference for the publication in which the scientificName was originally established under the rules of the associated nomenclaturalCode.",NA,NA,NA
"333","Name Published In ID","name published in id","An identifier for the publication in which the scientificName was originally established under the rules of the associated nomenclaturalCode.",NA,NA,NA
"334","Name Published In Year","name published in year","The four-digit year in which the scientificName was published.",NA,NA,NA
"335","Nomenclatural Code","nomenclatural code","The nomenclatural code under which the scientificName is constructed. Recommended best practice is to use a controlled vocabulary.",NA,NA,NA
"336","Nomenclatural Code","nomenclatural code","The nomenclatural code (or codes in the case of an ambiregnal name) under which the scientificName is constructed. Recommended best practice is to use a controlled vocabulary.",NA,NA,NA
"337","Nomenclatural Status","nomenclatural status","The status related to the original publication of the name and its conformance to the relevant rules of nomenclature. It is based essentially on an algorithm according to the business rules of the code. It requires no taxonomic opinion.",NA,NA,NA
"338","Occurrence ID","occurrence id","An identifier for the Occurrence (as opposed to a particular digital record of the occurrence). In the absence of a persistent global unique identifier, construct one from a combination of identifiers in the record that will most closely make the occurrenceID globally unique.",NA,NA,NA
"339","Occurrence Remarks","occurrence remarks","Comments or notes about the Occurrence.",NA,NA,NA
"340","Occurrence Status","occurrence status","A statement about the presence or absence of a Taxon at a Location. Recommended best practice is to use a controlled vocabulary.",NA,NA,NA
"341","Order","order","The name of the order in which the scientificName is classified.",NA,"order","order"
"342","Order","order","The full scientific name of the order in which the taxon is classified.",NA,"order","order"
"343","Organism ID","organism id","An identifier for the Organism instance (as opposed to a particular digital record of the Organism). May be a globally unique identifier or an identifier specific to the data set.",NA,NA,NA
"344","Organism Name","organism name","A textual name or label assigned to an Organism instance.",NA,NA,NA
"345","Organism Quantity","organism quantity","A number or enumeration value for the quantity of organisms.",NA,NA,NA
"346","Organism Quantity Type","organism quantity type","The type of quantification system used for the quantity of organisms.",NA,NA,NA
"347","Organism Remarks","organism remarks","Comments or notes about the Organism instance.",NA,NA,NA
"348","Organism Scope","organism scope","A description of the kind of Organism instance. Can be used to indicate whether the Organism instance represents a discrete organism or if it represents a particular type of aggregation. Recommended best practice is to use a controlled vocabulary.",NA,NA,NA
"349","Original Name Usage","original name usage","The taxon name, with authorship and date information if known, as it originally appeared when first established under the rules of the associated nomenclaturalCode. The basionym (botany) or basonym (bacteriology) of the scientificName or the senior/earlier homonym for replaced names.",NA,NA,NA
"350","Original Name Usage ID","original name usage id","An identifier for the name usage (documented meaning of the name according to a source) in which the terminal element of the scientificName was originally established under the rules of the associated nomenclaturalCode.",NA,NA,NA
"351","Other Catalog Numbers","other catalog numbers","A list (concatenated and separated) of previous or alternate fully qualified catalog numbers or other human-used identifiers for the same Occurrence, whether in the current or any other data set or collection.",NA,NA,NA
"352","Owner Institution Code","owner institution code","The name (or acronym) in use by the institution having ownership of the object(s) or information referred to in the record.",NA,NA,NA
"353","Parent Event ID","parent event id","An identifier for the broader Event that groups this and potentially other Events.",NA,NA,NA
"354","Parent Name Usage","parent name usage","The full name, with authorship and date information if known, of the direct, most proximate higher-rank parent taxon (in a classification) of the most specific element of the scientificName.",NA,NA,NA
"355","Parent Name Usage ID","parent name usage id","An identifier for the name usage (documented meaning of the name according to a source) of the direct, most proximate higher-rank parent taxon (in a classification) of the most specific element of the scientificName.",NA,NA,NA
"356","Phylum","phylum","The name of the phlyum (or division) in which the scientificName is classified.",NA,"phylum","phylum"
"357","Phylum","phylum","The full scientific name of the phylum or division in which the taxon is classified.",NA,"phylum","phylum"
"358","Point Radius Spatial Fit","point radius spatial fit","The ratio of the area of the point-radius (decimalLatitude, decimalLongitude, coordinateUncertaintyInMeters) to the area of the true (original, or most specific) spatial representation of the Location. Legal values are 0, greater than or equal to 1, or undefined. A value of 1 is an exact match or 100% overlap. A value of 0 should be used if the given point-radius does not completely contain the original representation. The pointRadiusSpatialFit is undefined (and should be left blank) if the original representation is a point without uncertainty and the given georeference is not that same point (without uncertainty). If both the original and the given georeference are the same point, the pointRadiusSpatialFit is 1.",NA,NA,NA
"359","Preparations","preparations","A list (concatenated and separated) of preparations and preservation methods for a specimen.",NA,NA,"preparations"
"360","Previous Identifications","previous identifications","A list (concatenated and separated) of previous assignments of names to the subject.",NA,NA,NA
"361","Previous Identifications","previous identifications","A list (concatenated and separated) of previous assignments of names to the Occurrence.",NA,NA,NA
"362","Previous Identifications","previous identifications","A list (concatenated and separated) of previous assignments of names to the Organism.",NA,NA,NA
"363","Recorded By","recorded by","A list (concatenated and separated) of names of people, groups, or organizations responsible for recording the original Occurrence. The primary collector or observer, especially one who applies a personal identifier (recordNumber), should be listed first.",NA,NA,NA
"364","Record Number","record number","An identifier given to the Occurrence at the time it was recorded. Often serves as a link between field notes and an Occurrence record, such as a specimen collector's number.",NA,NA,NA
"365","Related Resource ID","related resource id","An identifier for a related resource (the object, rather than the subject of the relationship).",NA,NA,NA
"366","Relationship According To","relationship according to","The source (person, organization, publication, reference) establishing the relationship between the two resources.",NA,NA,NA
"367","Relationship Established Date","relationship established date","The date-time on which the relationship between the two resources was established. Recommended best practice is to use an encoding scheme, such as ISO 8601:2004(E).",NA,NA,NA
"368","Relationship Of Resource","relationship of resource","The relationship of the resource identified by relatedResourceID to the subject (optionally identified by the resourceID). Recommended best practice is to use a controlled vocabulary.",NA,NA,NA
"369","Relationship Remarks","relationship remarks","Comments or notes about the relationship between the two resources.",NA,NA,NA
"370","Reproductive Condition","reproductive condition","The reproductive condition of the biological individual(s) represented in the Occurrence. Recommended best practice is to use a controlled vocabulary.",NA,NA,NA
"371","Resource ID","resource id","An identifier for the resource that is the subject of the relationship.",NA,NA,NA
"372","Resource Relationship ID","resource relationship id","An identifier for an instance of relationship between one resource (the subject) and another (relatedResource, the object).",NA,NA,NA
"373","Sample Size Unit","sample size unit","The unit of measurement of the size (time duration, length, area, or volume) of a sample in a sampling event.",NA,NA,NA
"374","Sample Size Value","sample size value","A numeric value for a measurement of the size (time duration, length, area, or volume) of a sample in a sampling event.",NA,NA,NA
"375","Sampling Effort","sampling effort","The amount of effort expended during an Event.",NA,NA,NA
"376","Sampling Protocol","sampling protocol","The name of, reference to, or description of the method or protocol used during an Event.",NA,NA,NA
"377","Scientific Name","scientific name","The taxon name (with date and authorship information if applicable). When forming part of an Identification, this should be the name in lowest level taxonomic rank that can be determined. This term should not contain identification qualifications, which should instead be supplied in the IdentificationQualifier term.",NA,NA,NA
"378","Scientific Name","scientific name","The full scientific name, with authorship and date information if known. When forming part of an Identification, this should be the name in lowest level taxonomic rank that can be determined. This term should not contain identification qualifications, which should instead be supplied in the IdentificationQualifier term.",NA,NA,NA
