"","dwc","low_dwc","definition","plantr","speciesLink","gbif"
"1","type","type","The nature or genre of the resource.",NA,NA,"type"
"2","modified","modified","The most recent date-time on which the resource was changed.",NA,"modified","modified"
"3","language","language","A language of the resource.",NA,NA,"language"
"4","license","license","A legal document giving official permission to do something with the resource.",NA,NA,"license"
"5","rightsHolder","rightsholder","A person or organization owning or managing rights over the resource.",NA,NA,"rightsHolder"
"6","accessRights","accessrights","Information about who can access the resource or an indication of its security status. Access Rights may include information regarding access or restrictions based on privacy, security, or other policies.",NA,NA,"accessRights"
"7","bibliographicCitation","bibliographiccitation","A bibliographic reference for the resource as a statement indicating how this record should be cited (attributed) when used.",NA,NA,"bibliographicCitation"
"8","references","references","A related resource that is referenced, cited, or otherwise pointed to by the described resource.",NA,NA,"references"
"9","institutionID","institutionid","An identifier for the institution having custody of the object(s) or information referred to in the record.",NA,NA,"institutionID"
"10","collectionID","collectionid","An identifier for the collection or dataset from which the record was derived.",NA,NA,"collectionID"
"11","datasetID","datasetid","An identifier for the set of data. May be a global unique identifier or an identifier specific to a collection or institution.",NA,NA,"datasetID"
"12","institutionCode","institutioncode","The name (or acronym) in use by the institution having custody of the object(s) or information referred to in the record.","institutionCode","institutionCode","institutionCode"
"13","collectionCode","collectioncode","The name, acronym, coden, or initialism identifying the collection or data set from which the record was derived.","collectionCode","collectionCode","collectionCode"
"14","datasetName","datasetname","The name identifying the data set from which the record was derived.",NA,NA,"datasetName"
"15","ownerInstitutionCode","ownerinstitutioncode","The name (or acronym) in use by the institution having ownership of the object(s) or information referred to in the record.",NA,NA,"ownerInstitutionCode"
"16","basisOfRecord","basisofrecord","The specific nature of the data record.",NA,"basisOfRecord","basisOfRecord"
"17","informationWithheld","informationwithheld","Additional information that exists, but that has not been shared in the given record.",NA,NA,"informationWithheld"
"18","dataGeneralizations","datageneralizations","Actions taken to make the shared data less specific or complete than in its original form. Suggests that alternative data of higher quality may be available on request.",NA,NA,NA
"19","dynamicProperties","dynamicproperties","A list of additional measurements, facts, characteristics, or assertions about the record. Meant to provide a mechanism for structured content.",NA,NA,"dynamicProperties"
"20","occurrenceID","occurrenceid","An identifier for the Occurrence (as opposed to a particular digital record of the occurrence). In the absence of a persistent global unique identifier, construct one from a combination of identifiers in the record that will most closely make the occurrenceID globally unique.",NA,NA,"occurrenceID"
"21","catalogNumber","catalognumber","An identifier (preferably unique) for the record within the data set or collection.","catalogNumber","catalogNumber","catalogNumber"
"22","recordNumber","recordnumber","An identifier given to the Occurrence at the time it was recorded. Often serves as a link between field notes and an Occurrence record, such as a specimen collector's number.","recordNumber","recordNumber","recordNumber"
"23","recordedBy","recordedby","A list (concatenated and separated) of names of people, groups, or organizations responsible for recording the original Occurrence. The primary collector or observer, especially one who applies a personal identifier (recordNumber), should be listed first.","recordedBy","recordedBy","recordedBy"
"24","individualCount","individualcount","The number of individuals represented present at the time of the Occurrence.",NA,"individualCount","individualCount"
"25","organismQuantity","organismquantity","A number or enumeration value for the quantity of organisms.",NA,NA,"organismQuantity"
"26","organismQuantityType","organismquantitytype","The type of quantification system used for the quantity of organisms.",NA,NA,"organismQuantityType"
"27","sex","sex","The sex of the biological individual(s) represented in the Occurrence.",NA,"sex",NA
"28","lifeStage","lifestage","The age class or life stage of the biological individual(s) at the time the Occurrence was recorded.",NA,NA,"lifeStage"
"29","reproductiveCondition","reproductivecondition","The reproductive condition of the biological individual(s) represented in the Occurrence.",NA,NA,"reproductiveCondition"
"30","behavior","behavior","The behavior shown by the subject at the time the Occurrence was recorded.",NA,NA,NA
"31","establishmentMeans","establishmentmeans","The process by which the biological individual(s) represented in the Occurrence became established at the location.",NA,NA,NA
"32","occurrenceStatus","occurrencestatus","A statement about the presence or absence of a Taxon at a Location.",NA,NA,"occurrenceStatus"
"33","preparations","preparations","A list (concatenated and separated) of preparations and preservation methods for a specimen.",NA,NA,"preparations"
"34","disposition","disposition","The current state of a specimen with respect to the collection identified in collectionCode or collectionID.",NA,NA,"disposition"
"35","associatedMedia","associatedmedia","A list (concatenated and separated) of identifiers (publication, global unique identifier, URI) of media associated with the Occurrence.",NA,NA,NA
"36","associatedReferences","associatedreferences","A list (concatenated and separated) of identifiers (publication, bibliographic reference, global unique identifier, URI) of literature associated with the Occurrence.",NA,NA,NA
"37","associatedSequences","associatedsequences","A list (concatenated and separated) of identifiers (publication, global unique identifier, URI) of genetic sequence information associated with the Occurrence.",NA,NA,"associatedSequences"
"38","associatedTaxa","associatedtaxa","A list (concatenated and separated) of identifiers or names of taxa and their associations with the Occurrence.",NA,NA,NA
"39","otherCatalogNumbers","othercatalognumbers","A list (concatenated and separated) of previous or alternate fully qualified catalog numbers or other human-used identifiers for the same Occurrence, whether in the current or any other data set or collection.",NA,NA,"otherCatalogNumbers"
"40","occurrenceRemarks","occurrenceremarks","Comments or notes about the Occurrence.",NA,"occurrenceRemarks","occurrenceRemarks"
"41","organismID","organismid","An identifier for the Organism instance (as opposed to a particular digital record of the Organism). May be a globally unique identifier or an identifier specific to the data set.",NA,NA,"organismID"
"42","organismName","organismname","A textual name or label assigned to an Organism instance.",NA,NA,NA
"43","organismScope","organismscope","A description of the kind of Organism instance. Can be used to indicate whether the Organism instance represents a discrete organism or if it represents a particular type of aggregation.",NA,NA,NA
"44","associatedOccurrences","associatedoccurrences","A list (concatenated and separated) of identifiers of other Occurrence records and their associations to this Occurrence.",NA,NA,NA
"45","associatedOrganisms","associatedorganisms","A list (concatenated and separated) of identifiers of other Organisms and their associations to this Organism.",NA,NA,NA
"46","previousIdentifications","previousidentifications","A list (concatenated and separated) of previous assignments of names to the Organism.",NA,NA,"previousIdentifications"
"47","organismRemarks","organismremarks","Comments or notes about the Organism instance.",NA,NA,"organismRemarks"
"48","materialSampleID","materialsampleid","An identifier for the MaterialSample (as opposed to a particular digital record of the material sample). In the absence of a persistent global unique identifier, construct one from a combination of identifiers in the record that will most closely make the materialSampleID globally unique.",NA,NA,"materialSampleID"
"49","eventID","eventid","An identifier for the set of information associated with an Event (something that occurs at a place and time). May be a global unique identifier or an identifier specific to the data set.",NA,NA,"eventID"
"50","parentEventID","parenteventid","An identifier for the broader Event that groups this and potentially other Events.",NA,NA,NA
"51","fieldNumber","fieldnumber","An identifier given to the event in the field. Often serves as a link between field notes and the Event.",NA,"fieldNumber","fieldNumber"
"52","eventDate","eventdate","The date-time or interval during which an Event occurred. For occurrences, this is the date-time when the event was recorded. Not suitable for a time in a geological context.",NA,NA,"eventDate"
"53","eventTime","eventtime","The time or interval during which an Event occurred.",NA,"eventTime","eventTime"
"54","startDayOfYear","startdayofyear","The earliest ordinal day of the year on which the Event occurred (1 for January 1, 365 for December 31, except in a leap year, in which case it is 366).",NA,NA,"startDayOfYear"
"55","endDayOfYear","enddayofyear","The latest ordinal day of the year on which the Event occurred (1 for January 1, 365 for December 31, except in a leap year, in which case it is 366).",NA,NA,"endDayOfYear"
"56","year","year","The four-digit year in which the Event occurred, according to the Common Era Calendar.","year","year","year"
"57","month","month","The ordinal month in which the Event occurred.",NA,"month","month"
"58","day","day","The integer day of the month on which the Event occurred.",NA,"day","day"
"59","verbatimEventDate","verbatimeventdate","The verbatim original representation of the date and time information for an Event.",NA,NA,"verbatimEventDate"
"60","habitat","habitat","A category or description of the habitat in which the Event occurred.",NA,NA,"habitat"
"61","samplingProtocol","samplingprotocol","The name of, reference to, or description of the method or protocol used during an Event.",NA,NA,"samplingProtocol"
"62","sampleSizeValue","samplesizevalue","A numeric value for a measurement of the size (time duration, length, area, or volume) of a sample in a sampling event.",NA,NA,"sampleSizeValue"
"63","sampleSizeUnit","samplesizeunit","The unit of measurement of the size (time duration, length, area, or volume) of a sample in a sampling event.",NA,NA,"sampleSizeUnit"
"64","samplingEffort","samplingeffort","The amount of effort expended during an Event.",NA,NA,"samplingEffort"
"65","fieldNotes","fieldnotes","One of a) an indicator of the existence of, b) a reference to (publication, URI), or c) the text of notes taken in the field about the Event.",NA,NA,"fieldNotes"
"66","eventRemarks","eventremarks","Comments or notes about the Event.",NA,NA,"eventRemarks"
"67","Location","location","A spatial region or named place.",NA,NA,NA
"68","locationID","locationid","An identifier for the set of location information (data associated with dcterms:Location). May be a global unique identifier or an identifier specific to the data set.",NA,NA,"locationID"
"69","higherGeographyID","highergeographyid","An identifier for the geographic region within which the Location occurred.",NA,NA,NA
"70","higherGeography","highergeography","A list (concatenated and separated) of geographic names less specific than the information captured in the locality term.",NA,NA,"higherGeography"
"71","continent","continent","The name of the continent in which the Location occurs.",NA,NA,"continent"
"72","waterBody","waterbody","The name of the water body in which the Location occurs.",NA,NA,"waterBody"
"73","islandGroup","islandgroup","The name of the island group in which the Location occurs.",NA,NA,"islandGroup"
"74","island","island","The name of the island on or near which the Location occurs.",NA,NA,"island"
"75","country","country","The name of the country or major administrative unit in which the Location occurs.","country","country","country"
"76","countryCode","countrycode","The standard code for the country in which the Location occurs.",NA,NA,"countryCode"
"77","stateProvince","stateprovince","The name of the next smaller administrative region than country (state, province, canton, department, region, etc.) in which the Location occurs.","stateProvince","stateProvince","stateProvince"
"78","county","county","The full, unabbreviated name of the next smaller administrative region than stateProvince (county, shire, department, etc.) in which the Location occurs.","county","county","county"
"79","municipality","municipality","The full, unabbreviated name of the next smaller administrative region than county (city, municipality, etc.) in which the Location occurs. Do not use this term for a nearby named place that does not contain the actual location.","municipality",NA,"municipality"
"80","locality","locality","The specific description of the place. Less specific geographic information can be provided in other geographic terms (higherGeography, continent, country, stateProvince, county, municipality, waterBody, island, islandGroup). This term may contain information modified from the original to correct perceived errors or standardize the description.",NA,"locality","locality"
"81","verbatimLocality","verbatimlocality","The original textual description of the place.",NA,NA,"verbatimLocality"
"82","minimumElevationInMeters","minimumelevationinmeters","The lower limit of the range of elevation (altitude, usually above sea level), in meters.",NA,"minimumElevationInMeters",NA
"83","maximumElevationInMeters","maximumelevationinmeters","The upper limit of the range of elevation (altitude, usually above sea level), in meters.",NA,"maximumElevationInMeters",NA
"84","verbatimElevation","verbatimelevation","The original description of the elevation (altitude, usually above sea level) of the Location.",NA,NA,"verbatimElevation"
"85","minimumDepthInMeters","minimumdepthinmeters","The lesser depth of a range of depth below the local surface, in meters.",NA,"minimumDepthInMeters",NA
"86","maximumDepthInMeters","maximumdepthinmeters","The greater depth of a range of depth below the local surface, in meters.",NA,"maximumDepthInMeters",NA
"87","verbatimDepth","verbatimdepth","The original description of the depth below the local surface.",NA,NA,NA
"88","minimumDistanceAboveSurfaceInMeters","minimumdistanceabovesurfaceinmeters","The lesser distance in a range of distance from a reference surface in the vertical direction, in meters. Use positive values for locations above the surface, negative values for locations below. If depth measures are given, the reference surface is the location given by the depth, otherwise the reference surface is the location given by the elevation.",NA,NA,NA
"89","maximumDistanceAboveSurfaceInMeters","maximumdistanceabovesurfaceinmeters","The greater distance in a range of distance from a reference surface in the vertical direction, in meters. Use positive values for locations above the surface, negative values for locations below. If depth measures are given, the reference surface is the location given by the depth, otherwise the reference surface is the location given by the elevation.",NA,NA,NA
"90","locationAccordingTo","locationaccordingto","Information about the source of this Location information. Could be a publication (gazetteer), institution, or team of individuals.",NA,NA,"locationAccordingTo"
"91","locationRemarks","locationremarks","Comments or notes about the Location.",NA,NA,"locationRemarks"
"92","decimalLatitude","decimallatitude","The geographic latitude (in decimal degrees, using the spatial reference system given in geodeticDatum) of the geographic center of a Location. Positive values are north of the Equator, negative values are south of it. Legal values lie between -90 and 90, inclusive.","decimalLatitude","decimalLatitude","decimalLatitude"
"93","decimalLongitude","decimallongitude","The geographic longitude (in decimal degrees, using the spatial reference system given in geodeticDatum) of the geographic center of a Location. Positive values are east of the Greenwich Meridian, negative values are west of it. Legal values lie between -180 and 180, inclusive.","decimalLongitude","decimalLongitude","decimalLongitude"
"94","geodeticDatum","geodeticdatum","The ellipsoid, geodetic datum, or spatial reference system (SRS) upon which the geographic coordinates given in decimalLatitude and decimalLongitude as based.",NA,NA,"geodeticDatum"
"95","coordinateUncertaintyInMeters","coordinateuncertaintyinmeters","The horizontal distance (in meters) from the given decimalLatitude and decimalLongitude describing the smallest circle containing the whole of the Location. Leave the value empty if the uncertainty is unknown, cannot be estimated, or is not applicable (because there are no coordinates). Zero is not a valid value for this term.",NA,NA,"coordinateUncertaintyInMeters"
"96","coordinatePrecision","coordinateprecision","A decimal representation of the precision of the coordinates given in the decimalLatitude and decimalLongitude.",NA,"coordinatePrecision",NA
"97","pointRadiusSpatialFit","pointradiusspatialfit","The ratio of the area of the point-radius (decimalLatitude, decimalLongitude, coordinateUncertaintyInMeters) to the area of the true (original, or most specific) spatial representation of the Location. Legal values are 0, greater than or equal to 1, or undefined. A value of 1 is an exact match or 100% overlap. A value of 0 should be used if the given point-radius does not completely contain the original representation. The pointRadiusSpatialFit is undefined (and should be left blank) if the original representation is a point without uncertainty and the given georeference is not that same point (without uncertainty). If both the original and the given georeference are the same point, the pointRadiusSpatialFit is 1.",NA,NA,NA
"98","verbatimCoordinates","verbatimcoordinates","The verbatim original spatial coordinates of the Location. The coordinate ellipsoid, geodeticDatum, or full Spatial Reference System (SRS) for these coordinates should be stored in verbatimSRS and the coordinate system should be stored in verbatimCoordinateSystem.",NA,NA,NA
"99","verbatimLatitude","verbatimlatitude","The verbatim original latitude of the Location. The coordinate ellipsoid, geodeticDatum, or full Spatial Reference System (SRS) for these coordinates should be stored in verbatimSRS and the coordinate system should be stored in verbatimCoordinateSystem.",NA,"verbatimLatitude",NA
"100","verbatimLongitude","verbatimlongitude","The verbatim original longitude of the Location. The coordinate ellipsoid, geodeticDatum, or full Spatial Reference System (SRS) for these coordinates should be stored in verbatimSRS and the coordinate system should be stored in verbatimCoordinateSystem.",NA,"verbatimLongitude",NA
"101","verbatimCoordinateSystem","verbatimcoordinatesystem","The spatial coordinate system for the verbatimLatitude and verbatimLongitude or the verbatimCoordinates of the Location.",NA,NA,"verbatimCoordinateSystem"
"102","verbatimSRS","verbatimsrs","The ellipsoid, geodetic datum, or spatial reference system (SRS) upon which coordinates given in verbatimLatitude and verbatimLongitude, or verbatimCoordinates are based.",NA,NA,"verbatimSRS"
"103","footprintWKT","footprintwkt","A Well-Known Text (WKT) representation of the shape (footprint, geometry) that defines the Location. A Location may have both a point-radius representation (see decimalLatitude) and a footprint representation, and they may differ from each other.",NA,NA,NA
"104","footprintSRS","footprintsrs","A Well-Known Text (WKT) representation of the Spatial Reference System (SRS) for the footprintWKT of the Location. Do not use this term to describe the SRS of the decimalLatitude and decimalLongitude, even if it is the same as for the footprintWKT - use the geodeticDatum instead.",NA,NA,NA
"105","footprintSpatialFit","footprintspatialfit","The ratio of the area of the footprint (footprintWKT) to the area of the true (original, or most specific) spatial representation of the Location. Legal values are 0, greater than or equal to 1, or undefined. A value of 1 is an exact match or 100% overlap. A value of 0 should be used if the given footprint does not completely contain the original representation. The footprintSpatialFit is undefined (and should be left blank) if the original representation is a point and the given georeference is not that same point. If both the original and the given georeference are the same point, the footprintSpatialFit is 1.",NA,NA,NA
"106","georeferencedBy","georeferencedby","A list (concatenated and separated) of names of people, groups, or organizations who determined the georeference (spatial representation) for the Location.",NA,NA,"georeferencedBy"
"107","georeferencedDate","georeferenceddate","The date on which the Location was georeferenced.",NA,NA,"georeferencedDate"
"108","georeferenceProtocol","georeferenceprotocol","A description or reference to the methods used to determine the spatial footprint, coordinates, and uncertainties.",NA,NA,"georeferenceProtocol"
"109","georeferenceSources","georeferencesources","A list (concatenated and separated) of maps, gazetteers, or other resources used to georeference the Location, described specifically enough to allow anyone in the future to use the same resources.",NA,NA,"georeferenceSources"
"110","georeferenceVerificationStatus","georeferenceverificationstatus","A categorical description of the extent to which the georeference has been verified to represent the best possible spatial description.",NA,NA,"georeferenceVerificationStatus"
"111","georeferenceRemarks","georeferenceremarks","Notes or comments about the spatial description determination, explaining assumptions made in addition or opposition to the those formalized in the method referred to in georeferenceProtocol.",NA,NA,"georeferenceRemarks"
"112","geologicalContextID","geologicalcontextid","An identifier for the set of information associated with a GeologicalContext (the location within a geological context, such as stratigraphy). May be a global unique identifier or an identifier specific to the data set.",NA,NA,NA
"113","earliestEonOrLowestEonothem","earliesteonorlowesteonothem","The full name of the earliest possible geochronologic eon or lowest chrono-stratigraphic eonothem or the informal name (""Precambrian"") attributable to the stratigraphic horizon from which the cataloged item was collected.",NA,NA,NA
"114","latestEonOrHighestEonothem","latesteonorhighesteonothem","The full name of the latest possible geochronologic eon or highest chrono-stratigraphic eonothem or the informal name (""Precambrian"") attributable to the stratigraphic horizon from which the cataloged item was collected.",NA,NA,NA
"115","earliestEraOrLowestErathem","earliesteraorlowesterathem","The full name of the earliest possible geochronologic era or lowest chronostratigraphic erathem attributable to the stratigraphic horizon from which the cataloged item was collected.",NA,NA,NA
"116","latestEraOrHighestErathem","latesteraorhighesterathem","The full name of the latest possible geochronologic era or highest chronostratigraphic erathem attributable to the stratigraphic horizon from which the cataloged item was collected.",NA,NA,NA
"117","earliestPeriodOrLowestSystem","earliestperiodorlowestsystem","The full name of the earliest possible geochronologic period or lowest chronostratigraphic system attributable to the stratigraphic horizon from which the cataloged item was collected.",NA,NA,NA
"118","latestPeriodOrHighestSystem","latestperiodorhighestsystem","The full name of the latest possible geochronologic period or highest chronostratigraphic system attributable to the stratigraphic horizon from which the cataloged item was collected.",NA,NA,NA
"119","earliestEpochOrLowestSeries","earliestepochorlowestseries","The full name of the earliest possible geochronologic epoch or lowest chronostratigraphic series attributable to the stratigraphic horizon from which the cataloged item was collected.",NA,NA,NA
"120","latestEpochOrHighestSeries","latestepochorhighestseries","The full name of the latest possible geochronologic epoch or highest chronostratigraphic series attributable to the stratigraphic horizon from which the cataloged item was collected.",NA,NA,NA
"121","earliestAgeOrLowestStage","earliestageorloweststage","The full name of the earliest possible geochronologic age or lowest chronostratigraphic stage attributable to the stratigraphic horizon from which the cataloged item was collected.",NA,NA,NA
"122","latestAgeOrHighestStage","latestageorhigheststage","The full name of the latest possible geochronologic age or highest chronostratigraphic stage attributable to the stratigraphic horizon from which the cataloged item was collected.",NA,NA,NA
"123","lowestBiostratigraphicZone","lowestbiostratigraphiczone","The full name of the lowest possible geological biostratigraphic zone of the stratigraphic horizon from which the cataloged item was collected.",NA,NA,NA
